,Gene_set,Term,Overlap,P-value,Adjusted P-value,Old P-value,Old Adjusted P-value,Odds Ratio,Combined Score,Genes
1667,GO_Biological_Process_2021,negative regulation of protein depolymerization (GO:1901880),1/24,0.2172843114526798,0.4460254320546828,0,0,4.256134309083082,6.497195836752411,SPEF1
1668,GO_Biological_Process_2021,regulation of keratinocyte proliferation (GO:0010837),1/24,0.2172843114526798,0.4460254320546828,0,0,4.256134309083082,6.497195836752411,ZFP36
1669,GO_Biological_Process_2021,peptidyl-glutamic acid modification (GO:0018200),1/24,0.2172843114526798,0.4460254320546828,0,0,4.256134309083082,6.497195836752411,TTLL3
1670,GO_Biological_Process_2021,dorsal/ventral pattern formation (GO:0009953),1/24,0.2172843114526798,0.4460254320546828,0,0,4.256134309083082,6.497195836752411,FGF8
1671,GO_Biological_Process_2021,endocrine system development (GO:0035270),1/24,0.2172843114526798,0.4460254320546828,0,0,4.256134309083082,6.497195836752411,HESX1
1672,GO_Biological_Process_2021,extracellular matrix assembly (GO:0085029),1/24,0.2172843114526798,0.4460254320546828,0,0,4.256134309083082,6.497195836752411,NTNG2
1673,GO_Biological_Process_2021,positive regulation of cellular response to transforming growth factor beta stimulus (GO:1903846),1/24,0.2172843114526798,0.4460254320546828,0,0,4.256134309083082,6.497195836752411,CITED1
1674,GO_Biological_Process_2021,positive regulation of neuron apoptotic process (GO:0043525),1/24,0.2172843114526798,0.4460254320546828,0,0,4.256134309083082,6.497195836752411,EPHA7
1675,GO_Biological_Process_2021,leukotriene metabolic process (GO:0006691),1/24,0.2172843114526798,0.4460254320546828,0,0,4.256134309083082,6.497195836752411,DPEP2
1676,GO_Biological_Process_2021,positive regulation of transcription from RNA polymerase II promoter in response to stress (GO:0036003),1/24,0.2172843114526798,0.4460254320546828,0,0,4.256134309083082,6.497195836752411,ATF3
1677,GO_Biological_Process_2021,positive regulation of transforming growth factor beta receptor signaling pathway (GO:0030511),1/24,0.2172843114526798,0.4460254320546828,0,0,4.256134309083082,6.497195836752411,CITED1
1678,GO_Biological_Process_2021,potassium ion homeostasis (GO:0055075),1/24,0.2172843114526798,0.4460254320546828,0,0,4.256134309083082,6.497195836752411,SLC12A3
1679,GO_Biological_Process_2021,cellular response to cytokine stimulus (GO:0071345),7/482,0.219460439229242,0.4496748382755249,0,0,1.452781954887218,2.203264842624605,CCL25;EGR1;ZFP36;EDN2;POU2F1;DUSP1;FOS
1680,GO_Biological_Process_2021,regulation of transcription from RNA polymerase II promoter in response to stress (GO:0043618),2/87,0.2209966653247772,0.4508761771390222,0,0,2.3075212174422006,3.4834517207076385,DNAJB1;ATF3
1681,GO_Biological_Process_2021,"positive regulation of transcription, DNA-templated (GO:0045893)",15/1183,0.2220871761410469,0.4508761771390222,0,0,1.2725653963858934,1.9148104310675464,EGR1;JUN;JUND;POU2F1;EGR4;CITED1;GATA4;ETV1;FOS;NR0B2;NR4A1;ID2;SSBP2;ATF3;IER2
1682,GO_Biological_Process_2021,negative regulation of cellular carbohydrate metabolic process (GO:0010677),1/25,0.2252384091287941,0.4508761771390222,0,0,4.078589108910891,6.079527965441561,C1QTNF3
1683,GO_Biological_Process_2021,regulation of cAMP-mediated signaling (GO:0043949),1/25,0.2252384091287941,0.4508761771390222,0,0,4.078589108910891,6.079527965441561,SCTR
1684,GO_Biological_Process_2021,cardiac conduction system development (GO:0003161),1/25,0.2252384091287941,0.4508761771390222,0,0,4.078589108910891,6.079527965441561,GATA4
1685,GO_Biological_Process_2021,regulation of epidermal cell differentiation (GO:0045604),1/25,0.2252384091287941,0.4508761771390222,0,0,4.078589108910891,6.079527965441561,ZFP36
1686,GO_Biological_Process_2021,regulation of microtubule depolymerization (GO:0031114),1/25,0.2252384091287941,0.4508761771390222,0,0,4.078589108910891,6.079527965441561,SPEF1
1687,GO_Biological_Process_2021,regulation of myotube differentiation (GO:0010830),1/25,0.2252384091287941,0.4508761771390222,0,0,4.078589108910891,6.079527965441561,HDAC9
1688,GO_Biological_Process_2021,peripheral nervous system development (GO:0007422),1/25,0.2252384091287941,0.4508761771390222,0,0,4.078589108910891,6.079527965441561,SERPINI1
1689,GO_Biological_Process_2021,regulation of spindle assembly (GO:0090169),1/25,0.2252384091287941,0.4508761771390222,0,0,4.078589108910891,6.079527965441561,HSPA1B
1690,GO_Biological_Process_2021,sodium ion homeostasis (GO:0055078),1/25,0.2252384091287941,0.4508761771390222,0,0,4.078589108910891,6.079527965441561,SLC12A3
1691,GO_Biological_Process_2021,positive regulation of vascular endothelial growth factor production (GO:0010575),1/25,0.2252384091287941,0.4508761771390222,0,0,4.078589108910891,6.079527965441561,GATA4
1692,GO_Biological_Process_2021,ventricular cardiac muscle tissue development (GO:0003229),1/25,0.2252384091287941,0.4508761771390222,0,0,4.078589108910891,6.079527965441561,ID2
1693,GO_Biological_Process_2021,cellular response to oxygen-containing compound (GO:1901701),5/323,0.231726336063499,0.4601110611967877,0,0,1.5468362874023251,2.2617812189051008,EGR1;JUN;ZFP36;FOS;LAMTOR4
1694,GO_Biological_Process_2021,sodium ion transport (GO:0006814),2/90,0.2322137993294834,0.4601110611967877,0,0,2.2285165083672545,3.253849784389077,SLC12A3;SLC23A1
1695,GO_Biological_Process_2021,regulation of mitotic metaphase/anaphase transition (GO:0030071),1/26,0.233112069977469,0.4601110611967877,0,0,3.915247524752475,5.701524214455285,DUSP1
1696,GO_Biological_Process_2021,regulation of monocyte chemotaxis (GO:0090025),1/26,0.233112069977469,0.4601110611967877,0,0,3.915247524752475,5.701524214455285,DUSP1
1697,GO_Biological_Process_2021,regulation of synapse organization (GO:0050807),1/26,0.233112069977469,0.4601110611967877,0,0,3.915247524752475,5.701524214455285,SLITRK2
1698,GO_Biological_Process_2021,lamellipodium assembly (GO:0030032),1/26,0.233112069977469,0.4601110611967877,0,0,3.915247524752475,5.701524214455285,SPEF1
1699,GO_Biological_Process_2021,meiosis I (GO:0007127),1/26,0.233112069977469,0.4601110611967877,0,0,3.915247524752475,5.701524214455285,CCNA1
1700,GO_Biological_Process_2021,mononuclear cell differentiation (GO:1903131),1/26,0.233112069977469,0.4601110611967877,0,0,3.915247524752475,5.701524214455285,MT1G
1701,GO_Biological_Process_2021,regulation of actin cytoskeleton organization (GO:0032956),2/91,0.2359611637768341,0.4639561318826579,0,0,2.2033651964894627,3.1818533451133684,FAM107A;NEB
1702,GO_Biological_Process_2021,regulation of transcription by RNA polymerase II (GO:0006357),26/2206,0.2373447647666904,0.4639561318826579,0,0,1.1870678484424402,1.707290232554555,DLX2;CITED1;GATA4;HDAC9;DNAJB1;ZFP36;HESX1;HOXC5;IER2;HES6;EGR1;JUN;LEFTY1;EGR3;JUND;POU2F1;EGR4;OLIG3;ETV1;FOS;NR0B2;NR4A1;ID2;FOSB;SSBP2;ATF3
1703,GO_Biological_Process_2021,regulation of MAPK cascade (GO:0043408),3/166,0.2380077622967872,0.4639561318826579,0,0,1.8068098159509205,2.593588747936342,EPHA7;DUSP1;REN
1704,GO_Biological_Process_2021,regulation of endothelial cell proliferation (GO:0001936),2/92,0.2397119121498834,0.4639561318826579,0,0,2.1787728026534,3.111979197707302,NR4A1;EGR3
1705,GO_Biological_Process_2021,positive regulation of transmembrane receptor protein serine/threonine kinase signaling pathway (GO:0090100),2/92,0.2397119121498834,0.4639561318826579,0,0,2.1787728026534,3.111979197707302,LEFTY1;CITED1
1706,GO_Biological_Process_2021,negative regulation of cation channel activity (GO:2001258),1/27,0.2409061033872914,0.4639561318826579,0,0,3.7644706778370143,5.358151938014991,KCNE3
1707,GO_Biological_Process_2021,cellular senescence (GO:0090398),1/27,0.2409061033872914,0.4639561318826579,0,0,3.7644706778370143,5.358151938014991,ID2
1708,GO_Biological_Process_2021,nucleobase-containing small molecule interconversion (GO:0015949),1/27,0.2409061033872914,0.4639561318826579,0,0,3.7644706778370143,5.358151938014991,AK8
1709,GO_Biological_Process_2021,entrainment of circadian clock by photoperiod (GO:0043153),1/27,0.2409061033872914,0.4639561318826579,0,0,3.7644706778370143,5.358151938014991,ID2
1710,GO_Biological_Process_2021,positive regulation of cellular component movement (GO:0051272),1/27,0.2409061033872914,0.4639561318826579,0,0,3.7644706778370143,5.358151938014991,TUBB2B
1711,GO_Biological_Process_2021,regulation of vascular endothelial growth factor production (GO:0010574),1/27,0.2409061033872914,0.4639561318826579,0,0,3.7644706778370143,5.358151938014991,GATA4
1712,GO_Biological_Process_2021,positive regulation of erythrocyte differentiation (GO:0045648),1/27,0.2409061033872914,0.4639561318826579,0,0,3.7644706778370143,5.358151938014991,HSPA1B
1713,GO_Biological_Process_2021,positive regulation of gene silencing by miRNA (GO:2000637),1/27,0.2409061033872914,0.4639561318826579,0,0,3.7644706778370143,5.358151938014991,ZFP36
1714,GO_Biological_Process_2021,monovalent inorganic cation homeostasis (GO:0055067),1/27,0.2409061033872914,0.4639561318826579,0,0,3.7644706778370143,5.358151938014991,SLC12A3
1715,GO_Biological_Process_2021,"DNA-templated transcription, initiation (GO:0006352)",3/168,0.2434046174808809,0.4639561318826579,0,0,1.7847272727272727,2.521873406372216,NR4A1;NR0B2;HDAC9
1716,GO_Biological_Process_2021,regulation of epithelial cell proliferation (GO:0050678),2/93,0.2434655921686334,0.4639561318826579,0,0,2.154720900989558,3.044145844024328,NR4A1;ZFP36
1717,GO_Biological_Process_2021,amide transport (GO:0042886),1/28,0.248621310707713,0.4639561318826579,0,0,3.6248624862486247,5.045171985047641,SLC14A2
1718,GO_Biological_Process_2021,regulation of calcineurin-NFAT signaling cascade (GO:0070884),1/28,0.248621310707713,0.4639561318826579,0,0,3.6248624862486247,5.045171985047641,RCAN1
1719,GO_Biological_Process_2021,calcium ion import (GO:0070509),1/28,0.248621310707713,0.4639561318826579,0,0,3.6248624862486247,5.045171985047641,MICU3
1720,GO_Biological_Process_2021,negative regulation of phosphatase activity (GO:0010923),1/28,0.248621310707713,0.4639561318826579,0,0,3.6248624862486247,5.045171985047641,PPP1R15A
1721,GO_Biological_Process_2021,cellular response to acid chemical (GO:0071229),1/28,0.248621310707713,0.4639561318826579,0,0,3.6248624862486247,5.045171985047641,LAMTOR4
1722,GO_Biological_Process_2021,cellular response to epidermal growth factor stimulus (GO:0071364),1/28,0.248621310707713,0.4639561318826579,0,0,3.6248624862486247,5.045171985047641,ZFP36
1723,GO_Biological_Process_2021,regulation of extrinsic apoptotic signaling pathway in absence of ligand (GO:2001239),1/28,0.248621310707713,0.4639561318826579,0,0,3.6248624862486247,5.045171985047641,HSPA1B
1724,GO_Biological_Process_2021,cytosolic calcium ion transport (GO:0060401),1/28,0.248621310707713,0.4639561318826579,0,0,3.6248624862486247,5.045171985047641,MICU3
1725,GO_Biological_Process_2021,regulation of muscle contraction (GO:0006937),1/28,0.248621310707713,0.4639561318826579,0,0,3.6248624862486247,5.045171985047641,MYLK2
1726,GO_Biological_Process_2021,regulation of neuron migration (GO:2001222),1/28,0.248621310707713,0.4639561318826579,0,0,3.6248624862486247,5.045171985047641,NTNG2
1727,GO_Biological_Process_2021,regulation of plasma membrane bounded cell projection organization (GO:0120035),1/28,0.248621310707713,0.4639561318826579,0,0,3.6248624862486247,5.045171985047641,NTNG2
1728,GO_Biological_Process_2021,photoperiodism (GO:0009648),1/28,0.248621310707713,0.4639561318826579,0,0,3.6248624862486247,5.045171985047641,ID2
1729,GO_Biological_Process_2021,positive regulation of cell communication (GO:0010647),1/28,0.248621310707713,0.4639561318826579,0,0,3.6248624862486247,5.045171985047641,SYT1
1730,GO_Biological_Process_2021,positive regulation of microtubule polymerization (GO:0031116),1/28,0.248621310707713,0.4639561318826579,0,0,3.6248624862486247,5.045171985047641,HSPA1B
1731,GO_Biological_Process_2021,positive regulation of response to wounding (GO:1903036),1/28,0.248621310707713,0.4639561318826579,0,0,3.6248624862486247,5.045171985047641,CLDN4
1732,GO_Biological_Process_2021,ventricular septum morphogenesis (GO:0060412),1/28,0.248621310707713,0.4639561318826579,0,0,3.6248624862486247,5.045171985047641,ROBO2
1733,GO_Biological_Process_2021,protein localization to lysosome (GO:0061462),1/28,0.248621310707713,0.4639561318826579,0,0,3.6248624862486247,5.045171985047641,LAMTOR4
1734,GO_Biological_Process_2021,mRNA metabolic process (GO:0016071),2/95,0.2509799819958885,0.4675848179428352,0,0,2.108168833253089,2.9142948505085324,ZFP36;HSPA1B
1735,GO_Biological_Process_2021,actin filament polymerization (GO:0030041),1/29,0.256258485189531,0.4704322435430578,0,0,3.4952263083451203,4.758990517664546,FAM107A
1736,GO_Biological_Process_2021,negative regulation of epithelial to mesenchymal transition (GO:0010719),1/29,0.256258485189531,0.4704322435430578,0,0,3.4952263083451203,4.758990517664546,IL17RD
1737,GO_Biological_Process_2021,negative regulation of transferase activity (GO:0051348),1/29,0.256258485189531,0.4704322435430578,0,0,3.4952263083451203,4.758990517664546,ZFP36
1738,GO_Biological_Process_2021,determination of bilateral symmetry (GO:0009855),1/29,0.256258485189531,0.4704322435430578,0,0,3.4952263083451203,4.758990517664546,LEFTY1
1739,GO_Biological_Process_2021,positive regulation of leukocyte migration (GO:0002687),1/29,0.256258485189531,0.4704322435430578,0,0,3.4952263083451203,4.758990517664546,EDN2
1740,GO_Biological_Process_2021,intrinsic apoptotic signaling pathway in response to endoplasmic reticulum stress (GO:0070059),1/29,0.256258485189531,0.4704322435430578,0,0,3.4952263083451203,4.758990517664546,PPP1R15A
1741,GO_Biological_Process_2021,lamellipodium organization (GO:0097581),1/29,0.256258485189531,0.4704322435430578,0,0,3.4952263083451203,4.758990517664546,SPEF1
1742,GO_Biological_Process_2021,limb development (GO:0060173),1/29,0.256258485189531,0.4704322435430578,0,0,3.4952263083451203,4.758990517664546,FGF8
1743,GO_Biological_Process_2021,transition metal ion homeostasis (GO:0055076),1/29,0.256258485189531,0.4704322435430578,0,0,3.4952263083451203,4.758990517664546,HEPH
1744,GO_Biological_Process_2021,regulation of MAP kinase activity (GO:0043405),2/97,0.2585008881284328,0.4737784134691569,0,0,2.0635768525792093,2.791722634646685,DUSP1;DIRAS2
1745,GO_Biological_Process_2021,cation transport (GO:0006812),3/174,0.2597087014614996,0.4752206222853049,0,0,1.721578947368421,2.3210235350965718,SLC12A3;SLC23A1;KCNMB2
1746,GO_Biological_Process_2021,negative regulation of neuron death (GO:1901215),2/98,0.2622627448825198,0.478091472583566,0,0,2.0419776119402986,2.7330000592264847,CHGA;CITED1
1747,GO_Biological_Process_2021,regulation of neuron apoptotic process (GO:0043523),2/98,0.2622627448825198,0.478091472583566,0,0,2.0419776119402986,2.7330000592264847,EPHA7;CITED1
1748,GO_Biological_Process_2021,positive regulation of nucleic acid-templated transcription (GO:1903508),7/511,0.2633191911479169,0.478091472583566,0,0,1.3671343537414966,1.824288124622167,EGR1;JUN;CITED1;ID2;GATA4;FOS;NR0B2
1749,GO_Biological_Process_2021,regulation of long-term synaptic potentiation (GO:1900271),1/30,0.2638184122405329,0.478091472583566,0,0,3.374530556503926,4.496542545859288,FAM107A
1750,GO_Biological_Process_2021,regulation of vasoconstriction (GO:0019229),1/30,0.2638184122405329,0.478091472583566,0,0,3.374530556503926,4.496542545859288,KCNMB2
1751,GO_Biological_Process_2021,long-chain fatty acid biosynthetic process (GO:0042759),1/30,0.2638184122405329,0.478091472583566,0,0,3.374530556503926,4.496542545859288,CYP2C9
1752,GO_Biological_Process_2021,organic anion transport (GO:0015711),2/99,0.2660249992088973,0.4813176668378927,0,0,2.0208237164692004,2.6759040216211947,SLC23A1;SLCO4C1
1753,GO_Biological_Process_2021,organic acid transport (GO:0015849),2/100,0.2697872573969225,0.4838859565895975,0,0,2.000101533150574,2.620376153040449,SLC7A7;SLC23A1
1754,GO_Biological_Process_2021,negative regulation of DNA binding (GO:0043392),1/31,0.2713018693722012,0.4838859565895975,0,0,3.261881188118812,4.255199584153424,JUN
1755,GO_Biological_Process_2021,negative regulation of interleukin-6 production (GO:0032715),1/31,0.2713018693722012,0.4838859565895975,0,0,3.261881188118812,4.255199584153424,C1QTNF3
1756,GO_Biological_Process_2021,cardiac muscle cell action potential involved in contraction (GO:0086002),1/31,0.2713018693722012,0.4838859565895975,0,0,3.261881188118812,4.255199584153424,KCNE3
1757,GO_Biological_Process_2021,negative regulation of osteoblast differentiation (GO:0045668),1/31,0.2713018693722012,0.4838859565895975,0,0,3.261881188118812,4.255199584153424,CITED1
1758,GO_Biological_Process_2021,regulation of developmental growth (GO:0048638),1/31,0.2713018693722012,0.4838859565895975,0,0,3.261881188118812,4.255199584153424,NRCAM
1759,GO_Biological_Process_2021,triglyceride homeostasis (GO:0070328),1/31,0.2713018693722012,0.4838859565895975,0,0,3.261881188118812,4.255199584153424,C1QTNF3
1760,GO_Biological_Process_2021,vitamin transport (GO:0051180),1/31,0.2713018693722012,0.4838859565895975,0,0,3.261881188118812,4.255199584153424,SLC23A1
1761,GO_Biological_Process_2021,prostaglandin metabolic process (GO:0006693),1/31,0.2713018693722012,0.4838859565895975,0,0,3.261881188118812,4.255199584153424,EDN2
1762,GO_Biological_Process_2021,cell junction assembly (GO:0034329),2/102,0.2773102499911486,0.487849872949582,0,0,1.959900497512438,2.513804368738528,CDHR3;NRCAM
1763,GO_Biological_Process_2021,negative regulation of cell-matrix adhesion (GO:0001953),1/32,0.2787096262643759,0.487849872949582,0,0,3.156499520919834,4.032695825584145,FAM107A
1764,GO_Biological_Process_2021,negative regulation of chemotaxis (GO:0050922),1/32,0.2787096262643759,0.487849872949582,0,0,3.156499520919834,4.032695825584145,ROBO2
1765,GO_Biological_Process_2021,regulation of cell migration involved in sprouting angiogenesis (GO:0090049),1/32,0.2787096262643759,0.487849872949582,0,0,3.156499520919834,4.032695825584145,HDAC9
1766,GO_Biological_Process_2021,negative regulation of microtubule polymerization or depolymerization (GO:0031111),1/32,0.2787096262643759,0.487849872949582,0,0,3.156499520919834,4.032695825584145,SPEF1
1767,GO_Biological_Process_2021,regulation of centrosome duplication (GO:0010824),1/32,0.2787096262643759,0.487849872949582,0,0,3.156499520919834,4.032695825584145,RAB6C
1768,GO_Biological_Process_2021,cardiac muscle tissue morphogenesis (GO:0055008),1/32,0.2787096262643759,0.487849872949582,0,0,3.156499520919834,4.032695825584145,MYLK2
1769,GO_Biological_Process_2021,regulation of dendrite morphogenesis (GO:0048814),1/32,0.2787096262643759,0.487849872949582,0,0,3.156499520919834,4.032695825584145,PTPRD
1770,GO_Biological_Process_2021,gene silencing by miRNA (GO:0035195),1/32,0.2787096262643759,0.487849872949582,0,0,3.156499520919834,4.032695825584145,ZFP36
1771,GO_Biological_Process_2021,response to amino acid (GO:0043200),1/32,0.2787096262643759,0.487849872949582,0,0,3.156499520919834,4.032695825584145,LAMTOR4
1772,GO_Biological_Process_2021,intra-Golgi vesicle-mediated transport (GO:0006891),1/32,0.2787096262643759,0.487849872949582,0,0,3.156499520919834,4.032695825584145,RAB6C
1773,GO_Biological_Process_2021,metal ion export (GO:0070839),1/32,0.2787096262643759,0.487849872949582,0,0,3.156499520919834,4.032695825584145,KCNE3
1774,GO_Biological_Process_2021,cellular response to organonitrogen compound (GO:0071417),2/103,0.2810702359503829,0.4912202730464123,0,0,1.9403970247771043,2.4626562245760506,EGR1;LAMTOR4
1775,GO_Biological_Process_2021,negative regulation of cytokine production (GO:0001818),3/182,0.2816585155910966,0.4914875797563339,0,0,1.6439664804469274,2.083003970521182,C1QTNF3;ZFP36;HDAC9
1776,GO_Biological_Process_2021,regulation of insulin secretion (GO:0050796),2/104,0.2848287286746342,0.493041099688234,0,0,1.9212759730757976,2.4128675370166124,CHGA;TRH
1777,GO_Biological_Process_2021,steroid metabolic process (GO:0008202),2/104,0.2848287286746342,0.493041099688234,0,0,1.9212759730757976,2.4128675370166124,CYP2C9;UGT2B15
1778,GO_Biological_Process_2021,actin filament bundle assembly (GO:0051017),1/33,0.2860424449032713,0.493041099688234,0,0,3.057704207920792,3.827068667523606,FAM107A
1779,GO_Biological_Process_2021,actin filament bundle organization (GO:0061572),1/33,0.2860424449032713,0.493041099688234,0,0,3.057704207920792,3.827068667523606,FAM107A
1780,GO_Biological_Process_2021,lytic vacuole organization (GO:0080171),1/33,0.2860424449032713,0.493041099688234,0,0,3.057704207920792,3.827068667523606,CLVS1
1781,GO_Biological_Process_2021,primary alcohol metabolic process (GO:0034308),1/33,0.2860424449032713,0.493041099688234,0,0,3.057704207920792,3.827068667523606,PECR
1782,GO_Biological_Process_2021,muscle cell development (GO:0055001),1/33,0.2860424449032713,0.493041099688234,0,0,3.057704207920792,3.827068667523606,NEB
1783,GO_Biological_Process_2021,negative chemotaxis (GO:0050919),1/33,0.2860424449032713,0.493041099688234,0,0,3.057704207920792,3.827068667523606,EPHA7
1784,GO_Biological_Process_2021,antigen receptor-mediated signaling pathway (GO:0050851),3/185,0.2899356159813415,0.4979502541001855,0,0,1.6166208791208792,2.001532481725566,BTNL8;FYB2;THEMIS
1785,GO_Biological_Process_2021,cellular response to peptide hormone stimulus (GO:0071375),2/106,0.2923398198430257,0.4979502541001855,0,0,1.884137007271336,2.3171840174942444,NR4A1;HDAC9
1786,GO_Biological_Process_2021,small GTPase mediated signal transduction (GO:0007264),2/106,0.2923398198430257,0.4979502541001855,0,0,1.884137007271336,2.3171840174942444,JUN;RAB6C
1787,GO_Biological_Process_2021,autophagosome maturation (GO:0097352),1/34,0.2933010796958577,0.4979502541001855,0,0,2.964896489648965,3.636610457451386,LIX1
1788,GO_Biological_Process_2021,cardiac muscle contraction (GO:0060048),1/34,0.2933010796958577,0.4979502541001855,0,0,2.964896489648965,3.636610457451386,MYLK2
1789,GO_Biological_Process_2021,cellular response to amino acid stimulus (GO:0071230),1/34,0.2933010796958577,0.4979502541001855,0,0,2.964896489648965,3.636610457451386,LAMTOR4
1790,GO_Biological_Process_2021,regulation of glucose metabolic process (GO:0010906),1/34,0.2933010796958577,0.4979502541001855,0,0,2.964896489648965,3.636610457451386,GNMT
1791,GO_Biological_Process_2021,regulation of keratinocyte differentiation (GO:0045616),1/34,0.2933010796958577,0.4979502541001855,0,0,2.964896489648965,3.636610457451386,ZFP36
1792,GO_Biological_Process_2021,organelle disassembly (GO:1903008),1/34,0.2933010796958577,0.4979502541001855,0,0,2.964896489648965,3.636610457451386,KIF9
1793,GO_Biological_Process_2021,positive regulation of protein dephosphorylation (GO:0035307),1/34,0.2933010796958577,0.4979502541001855,0,0,2.964896489648965,3.636610457451386,PPP1R15A
1794,GO_Biological_Process_2021,negative regulation of transmembrane receptor protein serine/threonine kinase signaling pathway (GO:0090101),2/108,0.2998407666538006,0.5040847062026579,0,0,1.8483995118745893,2.226404093753404,IL17RD;PBLD
1795,GO_Biological_Process_2021,acylglycerol catabolic process (GO:0046464),1/35,0.3004862774795294,0.5040847062026579,0,0,2.87754804892254,3.459829080820493,FABP2
1796,GO_Biological_Process_2021,negative regulation of cell cycle G1/S phase transition (GO:1902807),1/35,0.3004862774795294,0.5040847062026579,0,0,2.87754804892254,3.459829080820493,FAM107A
1797,GO_Biological_Process_2021,regulation of blood circulation (GO:1903522),1/35,0.3004862774795294,0.5040847062026579,0,0,2.87754804892254,3.459829080820493,KCNMB2
1798,GO_Biological_Process_2021,regulation of mitotic spindle organization (GO:0060236),1/35,0.3004862774795294,0.5040847062026579,0,0,2.87754804892254,3.459829080820493,HSPA1B
1799,GO_Biological_Process_2021,oxoacid metabolic process (GO:0043436),1/35,0.3004862774795294,0.5040847062026579,0,0,2.87754804892254,3.459829080820493,GNMT
1800,GO_Biological_Process_2021,response to estrogen (GO:0043627),1/35,0.3004862774795294,0.5040847062026579,0,0,2.87754804892254,3.459829080820493,CITED1
1801,GO_Biological_Process_2021,muscle cell differentiation (GO:0042692),1/35,0.3004862774795294,0.5040847062026579,0,0,2.87754804892254,3.459829080820493,NEB
1802,GO_Biological_Process_2021,regulation of gene expression (GO:0010468),13/1079,0.3021779852229858,0.5055007565930132,0,0,1.2022464698331194,1.438775334440603,HES6;EGR1;ZNF682;BTNL8;MYLK2;CITED1;LRRC19;GATA4;NR0B2;FGF8;ID2;SSBP2;HSPA1B
1803,GO_Biological_Process_2021,regulation of protein ubiquitination (GO:0031396),2/109,0.3035866054936304,0.5055007565930132,0,0,1.831031757102339,2.1827516322764966,FAM107A;HSPA1B
1804,GO_Biological_Process_2021,negative regulation of cell differentiation (GO:0045596),3/191,0.3065395682200703,0.5055007565930132,0,0,1.5645478723404256,1.8499346011731213,CITED1;ID2;IL17RD
1805,GO_Biological_Process_2021,response to tumor necrosis factor (GO:0034612),2/110,0.307328925587732,0.5055007565930132,0,0,1.8139856274184631,2.140206791289923,CCL25;ZFP36
1806,GO_Biological_Process_2021,regulation of cardiac muscle contraction (GO:0055117),1/36,0.3075987774839681,0.5055007565930132,0,0,2.795190947666195,3.2954155684322424,CHGA
1807,GO_Biological_Process_2021,regulation of cell cycle G1/S phase transition (GO:1902806),1/36,0.3075987774839681,0.5055007565930132,0,0,2.795190947666195,3.2954155684322424,ID2
1808,GO_Biological_Process_2021,calcium-dependent cell-cell adhesion via plasma membrane cell adhesion molecules (GO:0016339),1/36,0.3075987774839681,0.5055007565930132,0,0,2.795190947666195,3.2954155684322424,CDHR3
1809,GO_Biological_Process_2021,cellular response to heat (GO:0034605),1/36,0.3075987774839681,0.5055007565930132,0,0,2.795190947666195,3.2954155684322424,HSPA1B
