,Gene_set,Term,Overlap,P-value,Adjusted P-value,Old P-value,Old Adjusted P-value,Odds Ratio,Combined Score,Genes
618,KEGG_2021_Human,regulation of neuron apoptotic process (GO:0043523),2/98,0.2622627448825198,0.478091472583566,0,0,2.0419776119402986,2.7330000592264847,EPHA7;CITED1
619,KEGG_2021_Human,positive regulation of nucleic acid-templated transcription (GO:1903508),7/511,0.2633191911479169,0.478091472583566,0,0,1.3671343537414966,1.824288124622167,EGR1;JUN;CITED1;ID2;GATA4;FOS;NR0B2
620,KEGG_2021_Human,regulation of long-term synaptic potentiation (GO:1900271),1/30,0.2638184122405329,0.478091472583566,0,0,3.374530556503926,4.496542545859288,FAM107A
621,KEGG_2021_Human,regulation of vasoconstriction (GO:0019229),1/30,0.2638184122405329,0.478091472583566,0,0,3.374530556503926,4.496542545859288,KCNMB2
622,KEGG_2021_Human,long-chain fatty acid biosynthetic process (GO:0042759),1/30,0.2638184122405329,0.478091472583566,0,0,3.374530556503926,4.496542545859288,CYP2C9
623,KEGG_2021_Human,organic anion transport (GO:0015711),2/99,0.2660249992088973,0.4813176668378927,0,0,2.0208237164692004,2.6759040216211947,SLC23A1;SLCO4C1
624,KEGG_2021_Human,organic acid transport (GO:0015849),2/100,0.2697872573969225,0.4838859565895975,0,0,2.000101533150574,2.620376153040449,SLC7A7;SLC23A1
625,KEGG_2021_Human,negative regulation of DNA binding (GO:0043392),1/31,0.2713018693722012,0.4838859565895975,0,0,3.261881188118812,4.255199584153424,JUN
626,KEGG_2021_Human,negative regulation of interleukin-6 production (GO:0032715),1/31,0.2713018693722012,0.4838859565895975,0,0,3.261881188118812,4.255199584153424,C1QTNF3
627,KEGG_2021_Human,cardiac muscle cell action potential involved in contraction (GO:0086002),1/31,0.2713018693722012,0.4838859565895975,0,0,3.261881188118812,4.255199584153424,KCNE3
628,KEGG_2021_Human,negative regulation of osteoblast differentiation (GO:0045668),1/31,0.2713018693722012,0.4838859565895975,0,0,3.261881188118812,4.255199584153424,CITED1
629,KEGG_2021_Human,regulation of developmental growth (GO:0048638),1/31,0.2713018693722012,0.4838859565895975,0,0,3.261881188118812,4.255199584153424,NRCAM
630,KEGG_2021_Human,triglyceride homeostasis (GO:0070328),1/31,0.2713018693722012,0.4838859565895975,0,0,3.261881188118812,4.255199584153424,C1QTNF3
631,KEGG_2021_Human,vitamin transport (GO:0051180),1/31,0.2713018693722012,0.4838859565895975,0,0,3.261881188118812,4.255199584153424,SLC23A1
632,KEGG_2021_Human,prostaglandin metabolic process (GO:0006693),1/31,0.2713018693722012,0.4838859565895975,0,0,3.261881188118812,4.255199584153424,EDN2
633,KEGG_2021_Human,cell junction assembly (GO:0034329),2/102,0.2773102499911486,0.487849872949582,0,0,1.959900497512438,2.513804368738528,CDHR3;NRCAM
634,KEGG_2021_Human,negative regulation of cell-matrix adhesion (GO:0001953),1/32,0.2787096262643759,0.487849872949582,0,0,3.156499520919834,4.032695825584145,FAM107A
635,KEGG_2021_Human,negative regulation of chemotaxis (GO:0050922),1/32,0.2787096262643759,0.487849872949582,0,0,3.156499520919834,4.032695825584145,ROBO2
636,KEGG_2021_Human,regulation of cell migration involved in sprouting angiogenesis (GO:0090049),1/32,0.2787096262643759,0.487849872949582,0,0,3.156499520919834,4.032695825584145,HDAC9
637,KEGG_2021_Human,negative regulation of microtubule polymerization or depolymerization (GO:0031111),1/32,0.2787096262643759,0.487849872949582,0,0,3.156499520919834,4.032695825584145,SPEF1
638,KEGG_2021_Human,regulation of centrosome duplication (GO:0010824),1/32,0.2787096262643759,0.487849872949582,0,0,3.156499520919834,4.032695825584145,RAB6C
639,KEGG_2021_Human,cardiac muscle tissue morphogenesis (GO:0055008),1/32,0.2787096262643759,0.487849872949582,0,0,3.156499520919834,4.032695825584145,MYLK2
640,KEGG_2021_Human,regulation of dendrite morphogenesis (GO:0048814),1/32,0.2787096262643759,0.487849872949582,0,0,3.156499520919834,4.032695825584145,PTPRD
641,KEGG_2021_Human,gene silencing by miRNA (GO:0035195),1/32,0.2787096262643759,0.487849872949582,0,0,3.156499520919834,4.032695825584145,ZFP36
642,KEGG_2021_Human,response to amino acid (GO:0043200),1/32,0.2787096262643759,0.487849872949582,0,0,3.156499520919834,4.032695825584145,LAMTOR4
643,KEGG_2021_Human,intra-Golgi vesicle-mediated transport (GO:0006891),1/32,0.2787096262643759,0.487849872949582,0,0,3.156499520919834,4.032695825584145,RAB6C
644,KEGG_2021_Human,metal ion export (GO:0070839),1/32,0.2787096262643759,0.487849872949582,0,0,3.156499520919834,4.032695825584145,KCNE3
645,KEGG_2021_Human,cellular response to organonitrogen compound (GO:0071417),2/103,0.2810702359503829,0.4912202730464123,0,0,1.9403970247771043,2.4626562245760506,EGR1;LAMTOR4
646,KEGG_2021_Human,negative regulation of cytokine production (GO:0001818),3/182,0.2816585155910966,0.4914875797563339,0,0,1.6439664804469274,2.083003970521182,C1QTNF3;ZFP36;HDAC9
647,KEGG_2021_Human,regulation of insulin secretion (GO:0050796),2/104,0.2848287286746342,0.493041099688234,0,0,1.9212759730757976,2.4128675370166124,CHGA;TRH
648,KEGG_2021_Human,steroid metabolic process (GO:0008202),2/104,0.2848287286746342,0.493041099688234,0,0,1.9212759730757976,2.4128675370166124,CYP2C9;UGT2B15
649,KEGG_2021_Human,actin filament bundle assembly (GO:0051017),1/33,0.2860424449032713,0.493041099688234,0,0,3.057704207920792,3.827068667523606,FAM107A
650,KEGG_2021_Human,actin filament bundle organization (GO:0061572),1/33,0.2860424449032713,0.493041099688234,0,0,3.057704207920792,3.827068667523606,FAM107A
651,KEGG_2021_Human,lytic vacuole organization (GO:0080171),1/33,0.2860424449032713,0.493041099688234,0,0,3.057704207920792,3.827068667523606,CLVS1
652,KEGG_2021_Human,primary alcohol metabolic process (GO:0034308),1/33,0.2860424449032713,0.493041099688234,0,0,3.057704207920792,3.827068667523606,PECR
653,KEGG_2021_Human,muscle cell development (GO:0055001),1/33,0.2860424449032713,0.493041099688234,0,0,3.057704207920792,3.827068667523606,NEB
654,KEGG_2021_Human,negative chemotaxis (GO:0050919),1/33,0.2860424449032713,0.493041099688234,0,0,3.057704207920792,3.827068667523606,EPHA7
655,KEGG_2021_Human,antigen receptor-mediated signaling pathway (GO:0050851),3/185,0.2899356159813415,0.4979502541001855,0,0,1.6166208791208792,2.001532481725566,BTNL8;FYB2;THEMIS
656,KEGG_2021_Human,cellular response to peptide hormone stimulus (GO:0071375),2/106,0.2923398198430257,0.4979502541001855,0,0,1.884137007271336,2.3171840174942444,NR4A1;HDAC9
657,KEGG_2021_Human,small GTPase mediated signal transduction (GO:0007264),2/106,0.2923398198430257,0.4979502541001855,0,0,1.884137007271336,2.3171840174942444,JUN;RAB6C
658,KEGG_2021_Human,autophagosome maturation (GO:0097352),1/34,0.2933010796958577,0.4979502541001855,0,0,2.964896489648965,3.636610457451386,LIX1
659,KEGG_2021_Human,cardiac muscle contraction (GO:0060048),1/34,0.2933010796958577,0.4979502541001855,0,0,2.964896489648965,3.636610457451386,MYLK2
660,KEGG_2021_Human,cellular response to amino acid stimulus (GO:0071230),1/34,0.2933010796958577,0.4979502541001855,0,0,2.964896489648965,3.636610457451386,LAMTOR4
661,KEGG_2021_Human,regulation of glucose metabolic process (GO:0010906),1/34,0.2933010796958577,0.4979502541001855,0,0,2.964896489648965,3.636610457451386,GNMT
662,KEGG_2021_Human,regulation of keratinocyte differentiation (GO:0045616),1/34,0.2933010796958577,0.4979502541001855,0,0,2.964896489648965,3.636610457451386,ZFP36
663,KEGG_2021_Human,organelle disassembly (GO:1903008),1/34,0.2933010796958577,0.4979502541001855,0,0,2.964896489648965,3.636610457451386,KIF9
664,KEGG_2021_Human,positive regulation of protein dephosphorylation (GO:0035307),1/34,0.2933010796958577,0.4979502541001855,0,0,2.964896489648965,3.636610457451386,PPP1R15A
665,KEGG_2021_Human,negative regulation of transmembrane receptor protein serine/threonine kinase signaling pathway (GO:0090101),2/108,0.2998407666538006,0.5040847062026579,0,0,1.8483995118745893,2.226404093753404,IL17RD;PBLD
666,KEGG_2021_Human,acylglycerol catabolic process (GO:0046464),1/35,0.3004862774795294,0.5040847062026579,0,0,2.87754804892254,3.459829080820493,FABP2
667,KEGG_2021_Human,negative regulation of cell cycle G1/S phase transition (GO:1902807),1/35,0.3004862774795294,0.5040847062026579,0,0,2.87754804892254,3.459829080820493,FAM107A
668,KEGG_2021_Human,regulation of blood circulation (GO:1903522),1/35,0.3004862774795294,0.5040847062026579,0,0,2.87754804892254,3.459829080820493,KCNMB2
669,KEGG_2021_Human,regulation of mitotic spindle organization (GO:0060236),1/35,0.3004862774795294,0.5040847062026579,0,0,2.87754804892254,3.459829080820493,HSPA1B
670,KEGG_2021_Human,oxoacid metabolic process (GO:0043436),1/35,0.3004862774795294,0.5040847062026579,0,0,2.87754804892254,3.459829080820493,GNMT
671,KEGG_2021_Human,response to estrogen (GO:0043627),1/35,0.3004862774795294,0.5040847062026579,0,0,2.87754804892254,3.459829080820493,CITED1
672,KEGG_2021_Human,muscle cell differentiation (GO:0042692),1/35,0.3004862774795294,0.5040847062026579,0,0,2.87754804892254,3.459829080820493,NEB
673,KEGG_2021_Human,regulation of gene expression (GO:0010468),13/1079,0.3021779852229858,0.5055007565930132,0,0,1.2022464698331194,1.438775334440603,HES6;EGR1;ZNF682;BTNL8;MYLK2;CITED1;LRRC19;GATA4;NR0B2;FGF8;ID2;SSBP2;HSPA1B
674,KEGG_2021_Human,regulation of protein ubiquitination (GO:0031396),2/109,0.3035866054936304,0.5055007565930132,0,0,1.831031757102339,2.1827516322764966,FAM107A;HSPA1B
675,KEGG_2021_Human,negative regulation of cell differentiation (GO:0045596),3/191,0.3065395682200703,0.5055007565930132,0,0,1.5645478723404256,1.8499346011731213,CITED1;ID2;IL17RD
676,KEGG_2021_Human,response to tumor necrosis factor (GO:0034612),2/110,0.307328925587732,0.5055007565930132,0,0,1.8139856274184631,2.140206791289923,CCL25;ZFP36
677,KEGG_2021_Human,regulation of cardiac muscle contraction (GO:0055117),1/36,0.3075987774839681,0.5055007565930132,0,0,2.795190947666195,3.2954155684322424,CHGA
678,KEGG_2021_Human,regulation of cell cycle G1/S phase transition (GO:1902806),1/36,0.3075987774839681,0.5055007565930132,0,0,2.795190947666195,3.2954155684322424,ID2
679,KEGG_2021_Human,calcium-dependent cell-cell adhesion via plasma membrane cell adhesion molecules (GO:0016339),1/36,0.3075987774839681,0.5055007565930132,0,0,2.795190947666195,3.2954155684322424,CDHR3
680,KEGG_2021_Human,cellular response to heat (GO:0034605),1/36,0.3075987774839681,0.5055007565930132,0,0,2.795190947666195,3.2954155684322424,HSPA1B
681,KEGG_2021_Human,regulation of microtubule-based process (GO:0032886),1/36,0.3075987774839681,0.5055007565930132,0,0,2.795190947666195,3.2954155684322424,FAM107A
682,KEGG_2021_Human,positive regulation of cytokine-mediated signaling pathway (GO:0001961),1/36,0.3075987774839681,0.5055007565930132,0,0,2.795190947666195,3.2954155684322424,HSPA1B
683,KEGG_2021_Human,positive regulation of myeloid leukocyte differentiation (GO:0002763),1/36,0.3075987774839681,0.5055007565930132,0,0,2.795190947666195,3.2954155684322424,ID2
684,KEGG_2021_Human,macrophage activation (GO:0042116),1/36,0.3075987774839681,0.5055007565930132,0,0,2.795190947666195,3.2954155684322424,EDN2
685,KEGG_2021_Human,membrane assembly (GO:0071709),1/36,0.3075987774839681,0.5055007565930132,0,0,2.795190947666195,3.2954155684322424,PTPRD
686,KEGG_2021_Human,transition metal ion transport (GO:0000041),1/36,0.3075987774839681,0.5055007565930132,0,0,2.795190947666195,3.2954155684322424,HEPH
687,KEGG_2021_Human,Fc-epsilon receptor signaling pathway (GO:0038095),2/111,0.3110674136407643,0.5077302720132402,0,0,1.79725227075631,2.098733478308115,JUN;FOS
688,KEGG_2021_Human,negative regulation of G1/S transition of mitotic cell cycle (GO:2000134),1/37,0.3146393117416017,0.5077302720132402,0,0,2.717409240924092,3.1422173120611325,FAM107A
689,KEGG_2021_Human,negative regulation of stress-activated MAPK cascade (GO:0032873),1/37,0.3146393117416017,0.5077302720132402,0,0,2.717409240924092,3.1422173120611325,DUSP1
690,KEGG_2021_Human,regulation of microtubule cytoskeleton organization (GO:0070507),1/37,0.3146393117416017,0.5077302720132402,0,0,2.717409240924092,3.1422173120611325,FAM107A
691,KEGG_2021_Human,regulation of p38MAPK cascade (GO:1900744),1/37,0.3146393117416017,0.5077302720132402,0,0,2.717409240924092,3.1422173120611325,DUSP1
692,KEGG_2021_Human,regulation of protein autophosphorylation (GO:0031952),1/37,0.3146393117416017,0.5077302720132402,0,0,2.717409240924092,3.1422173120611325,EPHA7
693,KEGG_2021_Human,regulation of vascular associated smooth muscle cell proliferation (GO:1904705),1/37,0.3146393117416017,0.5077302720132402,0,0,2.717409240924092,3.1422173120611325,JUN
694,KEGG_2021_Human,positive regulation of myeloid cell differentiation (GO:0045639),1/37,0.3146393117416017,0.5077302720132402,0,0,2.717409240924092,3.1422173120611325,HSPA1B
695,KEGG_2021_Human,skeletal muscle tissue development (GO:0007519),1/37,0.3146393117416017,0.5077302720132402,0,0,2.717409240924092,3.1422173120611325,MYLK2
696,KEGG_2021_Human,lysosome localization (GO:0032418),1/37,0.3146393117416017,0.5077302720132402,0,0,2.717409240924092,3.1422173120611325,CHGA
697,KEGG_2021_Human,ncRNA metabolic process (GO:0034660),1/37,0.3146393117416017,0.5077302720132402,0,0,2.717409240924092,3.1422173120611325,TDRD1
698,KEGG_2021_Human,regulation of cytoskeleton organization (GO:0051493),2/112,0.3148017629842942,0.5077302720132402,0,0,1.78082315694256,2.0582970633849635,SPEF1;FAM107A
699,KEGG_2021_Human,Fc receptor signaling pathway (GO:0038093),2/112,0.3148017629842942,0.5077302720132402,0,0,1.78082315694256,2.0582970633849635,JUN;FOS
700,KEGG_2021_Human,sulfur compound biosynthetic process (GO:0044272),2/113,0.3185316735704009,0.5121242803760733,0,0,1.764690063197526,2.0188643073939105,GGTLC2;TPK1
701,KEGG_2021_Human,regulation of apoptotic signaling pathway (GO:2001233),1/38,0.3216086047711567,0.5121242803760733,0,0,2.643831950762644,2.999215804322112,GATA4
702,KEGG_2021_Human,regulation of axon extension (GO:0030516),1/38,0.3216086047711567,0.5121242803760733,0,0,2.643831950762644,2.999215804322112,NRCAM
703,KEGG_2021_Human,regulation of phosphoprotein phosphatase activity (GO:0043666),1/38,0.3216086047711567,0.5121242803760733,0,0,2.643831950762644,2.999215804322112,PPP1R15A
704,KEGG_2021_Human,positive regulation of insulin secretion (GO:0032024),1/38,0.3216086047711567,0.5121242803760733,0,0,2.643831950762644,2.999215804322112,TRH
705,KEGG_2021_Human,positive regulation of potassium ion transport (GO:0043268),1/38,0.3216086047711567,0.5121242803760733,0,0,2.643831950762644,2.999215804322112,KCNMB2
706,KEGG_2021_Human,lysosome organization (GO:0007040),1/38,0.3216086047711567,0.5121242803760733,0,0,2.643831950762644,2.999215804322112,CLVS1
707,KEGG_2021_Human,positive regulation of signaling (GO:0023056),1/38,0.3216086047711567,0.5121242803760733,0,0,2.643831950762644,2.999215804322112,SYT1
708,KEGG_2021_Human,mRNA destabilization (GO:0061157),1/38,0.3216086047711567,0.5121242803760733,0,0,2.643831950762644,2.999215804322112,ZFP36
709,KEGG_2021_Human,cellular amide metabolic process (GO:0043603),2/115,0.3259770102001946,0.5165526813560767,0,0,1.7332805001540967,1.9428833741192544,CYP2C9;PCCA
710,KEGG_2021_Human,negative regulation of protein secretion (GO:0050709),1/39,0.3285073739713579,0.5165526813560767,0,0,2.574127149557061,2.8655080306967835,CHGA
711,KEGG_2021_Human,regulation of heart rate by cardiac conduction (GO:0086091),1/39,0.3285073739713579,0.5165526813560767,0,0,2.574127149557061,2.8655080306967835,KCNE3
712,KEGG_2021_Human,regulation of intracellular transport (GO:0032386),1/39,0.3285073739713579,0.5165526813560767,0,0,2.574127149557061,2.8655080306967835,MYLK2
713,KEGG_2021_Human,odontogenesis (GO:0042476),1/39,0.3285073739713579,0.5165526813560767,0,0,2.574127149557061,2.8655080306967835,FGF8
714,KEGG_2021_Human,organophosphate biosynthetic process (GO:0090407),1/39,0.3285073739713579,0.5165526813560767,0,0,2.574127149557061,2.8655080306967835,TPK1
715,KEGG_2021_Human,DNA recombination (GO:0006310),1/39,0.3285073739713579,0.5165526813560767,0,0,2.574127149557061,2.8655080306967835,ENDOG
716,KEGG_2021_Human,membrane protein proteolysis (GO:0033619),1/39,0.3285073739713579,0.5165526813560767,0,0,2.574127149557061,2.8655080306967835,NAPSA
717,KEGG_2021_Human,"mitochondrial electron transport, NADH to ubiquinone (GO:0006120)",1/39,0.3285073739713579,0.5165526813560767,0,0,2.574127149557061,2.8655080306967835,NDUFA11
718,KEGG_2021_Human,bone development (GO:0060348),1/40,0.3353363294141514,0.5236441437186403,0,0,2.507996953541508,2.740290847623356,FGF8
719,KEGG_2021_Human,nucleocytoplasmic transport (GO:0006913),1/40,0.3353363294141514,0.5236441437186403,0,0,2.507996953541508,2.740290847623356,CITED1
720,KEGG_2021_Human,digestive tract development (GO:0048565),1/40,0.3353363294141514,0.5236441437186403,0,0,2.507996953541508,2.740290847623356,GATA4
721,KEGG_2021_Human,lymphocyte migration (GO:0072676),1/40,0.3353363294141514,0.5236441437186403,0,0,2.507996953541508,2.740290847623356,CCL25
722,KEGG_2021_Human,positive regulation of wound healing (GO:0090303),1/40,0.3353363294141514,0.5236441437186403,0,0,2.507996953541508,2.740290847623356,CLDN4
723,KEGG_2021_Human,axon guidance (GO:0007411),3/203,0.3398288185462522,0.5290775077451414,0,0,1.469775,1.586347651158044,ROBO2;EPHA7;NRXN3
724,KEGG_2021_Human,"regulation of transcription, DNA-templated (GO:0006355)",25/2244,0.3412168687404106,0.5290775077451414,0,0,1.1125823455246062,1.1962897314212622,DLX2;CITED1;GATA4;HDAC9;HESX1;HOXC5;SAMD11;HES6;EGR1;ZNF682;JUN;EGR3;JUND;POU2F1;EGR4;OLIG3;ETV1;FOS;NR0B2;CCNA1;NR4A1;ID2;FOSB;SSBP2;ATF3
725,KEGG_2021_Human,regulation of protein dephosphorylation (GO:0035304),1/41,0.3420961741841924,0.5290775077451414,0,0,2.445173267326733,2.6228477981110383,PPP1R15A
726,KEGG_2021_Human,positive regulation of cation transmembrane transport (GO:1904064),1/41,0.3420961741841924,0.5290775077451414,0,0,2.445173267326733,2.6228477981110383,KCNMB2
727,KEGG_2021_Human,regulation of viral transcription (GO:0046782),1/41,0.3420961741841924,0.5290775077451414,0,0,2.445173267326733,2.6228477981110383,ZFP36
728,KEGG_2021_Human,heart contraction (GO:0060047),1/41,0.3420961741841924,0.5290775077451414,0,0,2.445173267326733,2.6228477981110383,MYLK2
729,KEGG_2021_Human,positive regulation of TOR signaling (GO:0032008),1/41,0.3420961741841924,0.5290775077451414,0,0,2.445173267326733,2.6228477981110383,LAMTOR4
730,KEGG_2021_Human,regulation of chemokine production (GO:0032642),1/42,0.3487876042621172,0.5343028564612352,0,0,2.3854141511712146,2.5125379422438345,EGR1
731,KEGG_2021_Human,ceramide biosynthetic process (GO:0046513),1/42,0.3487876042621172,0.5343028564612352,0,0,2.3854141511712146,2.5125379422438345,ST8SIA4
732,KEGG_2021_Human,regulation of nervous system development (GO:0051960),1/42,0.3487876042621172,0.5343028564612352,0,0,2.3854141511712146,2.5125379422438345,HES6
733,KEGG_2021_Human,positive regulation of ATPase activity (GO:0032781),1/42,0.3487876042621172,0.5343028564612352,0,0,2.3854141511712146,2.5125379422438345,DNAJB1
734,KEGG_2021_Human,heterophilic cell-cell adhesion via plasma membrane cell adhesion molecules (GO:0007157),1/42,0.3487876042621172,0.5343028564612352,0,0,2.3854141511712146,2.5125379422438345,PTPRD
735,KEGG_2021_Human,potassium ion import across plasma membrane (GO:1990573),1/42,0.3487876042621172,0.5343028564612352,0,0,2.3854141511712146,2.5125379422438345,SLC12A3
736,KEGG_2021_Human,monocyte chemotaxis (GO:0002548),1/42,0.3487876042621172,0.5343028564612352,0,0,2.3854141511712146,2.5125379422438345,CCL25
737,KEGG_2021_Human,regulation of cell-cell adhesion (GO:0022407),1/43,0.3554113086456189,0.5380534299130615,0,0,2.3285007072135784,2.408786350456257,EPHA7
738,KEGG_2021_Human,development of primary male sexual characteristics (GO:0046546),1/43,0.3554113086456189,0.5380534299130615,0,0,2.3285007072135784,2.408786350456257,GATA4
739,KEGG_2021_Human,positive regulation of axonogenesis (GO:0050772),1/43,0.3554113086456189,0.5380534299130615,0,0,2.3285007072135784,2.408786350456257,ROBO2
740,KEGG_2021_Human,heart looping (GO:0001947),1/43,0.3554113086456189,0.5380534299130615,0,0,2.3285007072135784,2.408786350456257,GATA4
741,KEGG_2021_Human,signal release from synapse (GO:0099643),1/43,0.3554113086456189,0.5380534299130615,0,0,2.3285007072135784,2.408786350456257,SYT1
742,KEGG_2021_Human,positive regulation of peptide hormone secretion (GO:0090277),1/43,0.3554113086456189,0.5380534299130615,0,0,2.3285007072135784,2.408786350456257,TRH
743,KEGG_2021_Human,spermatid development (GO:0007286),1/43,0.3554113086456189,0.5380534299130615,0,0,2.3285007072135784,2.408786350456257,NME5
744,KEGG_2021_Human,male gonad development (GO:0008584),1/43,0.3554113086456189,0.5380534299130615,0,0,2.3285007072135784,2.408786350456257,GATA4
745,KEGG_2021_Human,positive regulation of epithelial cell proliferation (GO:0050679),2/123,0.355525118436797,0.5380534299130615,0,0,1.6180255746063072,1.673296317925633,NR4A1;EGR3
746,KEGG_2021_Human,branching morphogenesis of an epithelial tube (GO:0048754),1/44,0.361967969498813,0.5405579861959787,0,0,2.2742344001842043,2.311075981154161,CITED1
747,KEGG_2021_Human,cardiac ventricle morphogenesis (GO:0003208),1/44,0.361967969498813,0.5405579861959787,0,0,2.2742344001842043,2.311075981154161,GATA4
748,KEGG_2021_Human,neurotransmitter secretion (GO:0007269),1/44,0.361967969498813,0.5405579861959787,0,0,2.2742344001842043,2.311075981154161,SYT1
749,KEGG_2021_Human,embryonic organ morphogenesis (GO:0048562),1/44,0.361967969498813,0.5405579861959787,0,0,2.2742344001842043,2.311075981154161,ID2
750,KEGG_2021_Human,positive regulation of cell-matrix adhesion (GO:0001954),1/44,0.361967969498813,0.5405579861959787,0,0,2.2742344001842043,2.311075981154161,CCL25
751,KEGG_2021_Human,intracellular steroid hormone receptor signaling pathway (GO:0030518),1/44,0.361967969498813,0.5405579861959787,0,0,2.2742344001842043,2.311075981154161,SCGB2A2
752,KEGG_2021_Human,positive regulation of potassium ion transmembrane transport (GO:1901381),1/44,0.361967969498813,0.5405579861959787,0,0,2.2742344001842043,2.311075981154161,KCNMB2
753,KEGG_2021_Human,lymphocyte chemotaxis (GO:0048247),1/44,0.361967969498813,0.5405579861959787,0,0,2.2742344001842043,2.311075981154161,CCL25
754,KEGG_2021_Human,metal ion homeostasis (GO:0055065),1/44,0.361967969498813,0.5405579861959787,0,0,2.2742344001842043,2.311075981154161,SLC12A3
755,KEGG_2021_Human,mRNA stabilization (GO:0048255),1/44,0.361967969498813,0.5405579861959787,0,0,2.2742344001842043,2.311075981154161,ZFP36
756,KEGG_2021_Human,circulatory system development (GO:0072359),2/126,0.3664913712494586,0.5465901692742916,0,0,1.5786390627507625,1.584606794510144,ID2;HDAC9
757,KEGG_2021_Human,amino acid transmembrane transport (GO:0003333),1/45,0.3684582619913613,0.5466351876323875,0,0,2.222434743474347,2.218940716861633,SLC7A7
758,KEGG_2021_Human,positive regulation of chemotaxis (GO:0050921),1/45,0.3684582619913613,0.5466351876323875,0,0,2.222434743474347,2.218940716861633,EDN2
759,KEGG_2021_Human,positive regulation of Notch signaling pathway (GO:0045747),1/45,0.3684582619913613,0.5466351876323875,0,0,2.222434743474347,2.218940716861633,ROBO2
760,KEGG_2021_Human,protein deacetylation (GO:0006476),1/45,0.3684582619913613,0.5466351876323875,0,0,2.222434743474347,2.218940716861633,HDAC9
761,KEGG_2021_Human,negative regulation of multicellular organismal process (GO:0051241),3/214,0.3702630631264666,0.5485918612464314,0,0,1.3923696682464457,1.383377110772113,DLX2;IL17RD;HDAC9
762,KEGG_2021_Human,plasma membrane bounded cell projection organization (GO:0120036),2/128,0.3737625521597614,0.5525362180116712,0,0,1.5534233593935087,1.5287776305505074,BTG2;CFAP126
763,KEGG_2021_Human,alpha-amino acid metabolic process (GO:1901605),1/46,0.3748828547359966,0.5525362180116712,0,0,2.172937293729373,2.131959366863807,GNMT
764,KEGG_2021_Human,erythrocyte differentiation (GO:0030218),1/46,0.3748828547359966,0.5525362180116712,0,0,2.172937293729373,2.131959366863807,ID2
765,KEGG_2021_Human,"regulation of synaptic transmission, glutamatergic (GO:0051966)",1/46,0.3748828547359966,0.5525362180116712,0,0,2.172937293729373,2.131959366863807,SYT1
766,KEGG_2021_Human,regulation of DNA binding (GO:0051101),1/47,0.3812424094361227,0.5575423319344335,0,0,2.125591907016789,2.0497504921778424,JUN
767,KEGG_2021_Human,determination of heart left/right asymmetry (GO:0061371),1/47,0.3812424094361227,0.5575423319344335,0,0,2.125591907016789,2.0497504921778424,GATA4
768,KEGG_2021_Human,embryonic heart tube morphogenesis (GO:0003143),1/47,0.3812424094361227,0.5575423319344335,0,0,2.125591907016789,2.0497504921778424,GATA4
769,KEGG_2021_Human,regulation of wound healing (GO:0061041),1/47,0.3812424094361227,0.5575423319344335,0,0,2.125591907016789,2.0497504921778424,CLDN4
770,KEGG_2021_Human,histone deacetylation (GO:0016575),1/47,0.3812424094361227,0.5575423319344335,0,0,2.125591907016789,2.0497504921778424,HDAC9
771,KEGG_2021_Human,positive regulation of pathway-restricted SMAD protein phosphorylation (GO:0010862),1/47,0.3812424094361227,0.5575423319344335,0,0,2.125591907016789,2.0497504921778424,LEFTY1
772,KEGG_2021_Human,purine ribonucleotide biosynthetic process (GO:0009152),1/48,0.3875375813168027,0.5616558784424522,0,0,2.0802612176111226,1.9719679170263773,GUCY2C
773,KEGG_2021_Human,negative regulation of MAP kinase activity (GO:0043407),1/48,0.3875375813168027,0.5616558784424522,0,0,2.0802612176111226,1.9719679170263773,DUSP1
774,KEGG_2021_Human,negative regulation of mitotic cell cycle (GO:0045930),1/48,0.3875375813168027,0.5616558784424522,0,0,2.0802612176111226,1.9719679170263773,BTG2
775,KEGG_2021_Human,regulation of interleukin-2 production (GO:0032663),1/48,0.3875375813168027,0.5616558784424522,0,0,2.0802612176111226,1.9719679170263773,ZFP36
